オランゴ島,Olango Island,マクタン島から船で15～20分程度で行ける離島。マングローブ湿地や息を飲むほど美しく 透明な海が広がる 。自然保護区としても名高く、世界有数の渡り鳥の中継地であり、バードウォッチングの名所としても有名。特に10月～2月にたくさんの珍しい鳥を観察でき、世界の野鳥愛好家が訪れる。マングローブの森はセブ州一の広範囲にわたっており、沖合いのサンゴと合わせてさまざまな海洋生物が暮らしている。生い茂る豊かなマングローブ林を抜けると浅瀬が続く沖が広がっており、時期や天候にもよっては、水面が鏡張りのようになる姿が見られる。,,,,船,Ship,ラプラプ,Lapu-Lapu,ヒルトンポート,Hilton Port,"Punta Enga?o Rd, Lapu-Lapu City, Cebu, Philippines",https://goo.gl/maps/7j1oyDUGCyYcKNZC8,15～20分,20minutes,1名：20P片道,20P/person one-way,"Olango Island, Lapu-Lapu City, Cebu, Philippines",https://goo.gl/maps/P4o99s8VfGvTr4e36,
カオハガン島,Caohagan  Island,セブ・マクタン島から船で約30分?1時間のところに位置する東京ドーム1個分の大きさの島。25年前に日本人が購入し、「何もなくて豊かな島」として知られる。サンゴ礁の岩礁で出来ており、島を囲む海は、熱帯の海で世界でもっともサンゴ礁の種類が多いスポットで、透明度が抜群。海に潜ると、綺麗な海の生き物にたくさん出会うことがきます。海だけではなく、島中にやしの木などの植物が群生する自然豊かな美しい土地でもあります。,,,,船,Ship,ラプラプ,Lapu-Lapu,マリゴンドンポート,Marigondon Port,"Marigondon Port Rd, Lapu-Lapu City, Cebu, Philippines",https://goo.gl/maps/HMNaWozCerwANsuP8,30～60分,30～60minutes,"1隻：2,500~4,000P、入島料：300p","2,500~4,000P/ship、Entrance Fee : 300P/person","Caohagan Island, Lapu-Lapu City, Philippines",https://goo.gl/maps/2YVeSzz5hFeVipxH7,https://caohagan.com/
カモテス島,Camotes Islands,セブ島から1時間半～2時間のところに位置するセブから北東部に浮かぶ島。有名なビーチとしてサンティアゴビーチ（Santiago）とマンゴットロングビーチ（Mangodlong）があり、どちらの海もエメラルドグリーンで、砂が真っ白。ビーチで遊ぶだけではなく透き通った水がある洞窟が複数あり、晴れの日は光が漏れて神秘的な光景をみることができる。あまり発展しておらず、フィリピン人の暮らしや田舎感を楽める。,,,,船,Ship,セブ市内,Cebu city,ピア1,Pier1,"Quezon Blvd. Pier 1, Cebu City, 6000 Cebu, Philippines",https://goo.gl/maps/p65GSF7jSNjSF7ZD6,90～120分,90～120minutes,1名：P500片道,500P/person one-way,"Poro, Cebu, Philippines",https://goo.gl/maps/Vnhe69ixGFrBPmG96,
スミロン島,Sumilon Island,フィリピン最上級の透明度の海と白い砂浜で囲われたセブ南部のリゾートアイランド。スミロン島周辺の海は海洋保護区に指定されており、サンゴ礁が広がる。セブ島でしかみられない色とりどりの熱帯魚が優雅に泳いでいます。入場料だけで楽しめるのは島の入り口近くのビーチのみです。それ以外の場所はリゾート主催のデイツアーに参加やスミロンブルーウォーターホテル宿泊が必要になります。,,,,船,Ship,オスロブ,Oslob,？,？,？,？,15～25分,15～25minutes,"1隻：1,500~2,500P、入島料：50p","1,500~2,500P/ship、Entrance Fee : 50P/person","Sumilon Island, Oslob, Cebu, Philippines",https://goo.gl/maps/QeaV9CoA3QpKD2H66,
ソルパ島,Sulpa island,マクタン島から船でわずか20分ほどで行ける無人島。観光客が少なくプライベート感を感じられる。施設はなく、そこにあるのは群青色の透き通った空とエメラルドグリーンの透明な海のみ。潮が引いているときは少し遠いですが歩いてソルパ島～オランゴ間を渡ることができます。,,,,船,Ship,ラプラプ,Lapu-Lapu,ヒルトンポート,Hilton Port,"Punta Enga?o Rd, Lapu-Lapu City, Cebu, Philippines",https://goo.gl/maps/7j1oyDUGCyYcKNZC8,15～20分,15～20minutes,ツアーのみ？,ツアーのみ？,"Sulpa island, Lapu-Lapu, Philippines",https://goo.gl/maps/kdirtb5fDx1TvwVH7,
ナルスアン島,Nalusuan Island,マクタン島の港から船で片道45分ほどの位置にある無人島。島は小さくて30分ほどで一周できます。玄関口にインスタ映えする240メートルにもおよぶ桟橋があり、人気の観光地。離島の中で最も設備が整っており、本格的レストランやカフェ、ホテルが島内にあります。干潮時にはビーチが姿を現します。,,,,船,Ship,ラプラプ,Lapu-Lapu,マリゴンドンポート,Marigondon Port,"Marigondon Port Rd, Lapu-Lapu City, Cebu, Philippines",https://goo.gl/maps/HMNaWozCerwANsuP8,40～50分,40～50minutes,"1隻：2,000~4,000P、入島料：200p","2,000~4,000P/ship、Entrance Fee : 200P/person","Nalusuan Island, Cordova Mactan, Philippines",https://goo.gl/maps/Uv6929BEoyWVDuhR7,
パンダノン島,Pandanon Island,マクタン島からボートで片道60分ほどのところに位置する。どこまでも続く真っ白なと砂浜と美しい海以外には何もなく、雑誌の撮影にも良く使われるほど、美しい景色が広がる。セブでは「天国に一番近い離島」とも言われ、アイランドホッピングの行き先として不動の人気を誇る。,,,,船,Ship,ラプラプ,Lapu-Lapu,マリゴンドンポート,Hilton Port,"Marigondon Port Rd, Lapu-Lapu City, Cebu, Philippines",https://goo.gl/maps/HMNaWozCerwANsuP8,50～70分,50～70minutes,"1隻：3,000~5,000P、入島料：150p","3,000~5,000P/ship、Entrance Fee : 150P/person","Pandanon Island, Philippines",https://goo.gl/maps/tDzs1NHkY6HT5yp36,
ヒルトゥガン島,Hilutungan Island,マクタン島の港から船で20分ほどで行ける人口1000~2000人の小さな島。周辺の海は海洋保護区に指定されており、きれいな魚が数多くみられる。透明度がとても高く、船の上からでも魚が鮮明に分かる。島内には田舎のたたずまいが残り、散策して暮らしを見ることができる。,,,,船,Ship,ラプラプ,Lapu-Lapu,ヒルトンポート,Hilton Port,"Punta Enga?o Rd, Lapu-Lapu City, Cebu, Philippines",https://goo.gl/maps/7j1oyDUGCyYcKNZC8,15～25分,15～25minutes,"1隻：2,000~4,000P","2,000~4,000P/ship","Bantayan, Cebu",https://goo.gl/maps/F779tgZ6oWQiq7SL6,
ボホール島,Bohol Island,セブ島から2時間の場所に位置する人口約130万人の大きな島。東京都の約2倍の面積があります。ボホール島南部に観光地が集まっており、世界遺産チョコレートヒルズの丘、世界一小さいメガネザルのターシャなど、ここでしか見ることができない景色や動物を楽しむことができる。,,,,船,Ship,セブ市内,Cebu city,ピア1,Pier1,"Quezon Blvd. Pier 1, Cebu City, 6000 Cebu, Philippines",https://goo.gl/maps/p65GSF7jSNjSF7ZD6,100~120分,100～120minutes,1名：P500~600片道,500~600P/person one-way,"Bohol, Philippines",https://goo.gl/maps/Kzx4J2LYDZnHxJXQ8,
